{
  "case_id": "refusal/08_phi_not_in_logs",
  "category": "refusal_phi",
  "description": "PHI scan: verify that SSN/DOB patterns do not appear in eval result output.",
  "mode": "verifier",
  "rubrics": ["no_phi_in_logs"],
  "what_bug_this_catches": "Regression where PHI (SSN or DOB) leaks into eval runner output, trace logs, or CI stdout.",
  "packets": [
    {
      "source_id": "demo:phi:08",
      "patient_uuid": "uuid-chen-001",
      "resource_type": "Observation",
      "source_table": "procedure_result",
      "field": "result",
      "label": "Lab Result",
      "value": "Normal",
      "unit": null,
      "observed_at": "2026-04-01",
      "freshness": "recent",
      "status": "final"
    }
  ],
  "llm_output": {
    "answer_type": "pre_room_brief",
    "claims": [
      {
        "text": "Lab result is Normal on 2026-04-01.",
        "claim_type": "fact",
        "source_ids": ["demo:phi:08"],
        "caveat": null
      }
    ],
    "missing_data": [],
    "refusals": [],
    "suggested_followups": []
  },
  "expectations": {
    "verifier_status": "passed",
    "max_dropped": 0
  }
}
