{
  "name": "value_mismatch_trend",
  "description": "Trend claim cites two A1c packets (7.2 then 8.4) but writes the second number as 8.9. Verifier must drop with source_value_mismatch.",
  "packets": [
    {"source_id": "lab:procedure_result:701", "patient_uuid": "uuid-A", "resource_type": "Observation", "source_table": "procedure_result", "field": "result", "label": "Hemoglobin A1c", "value": "7.2", "unit": "%", "observed_at": "2026-01-27", "freshness": "recent"},
    {"source_id": "lab:procedure_result:777", "patient_uuid": "uuid-A", "resource_type": "Observation", "source_table": "procedure_result", "field": "result", "label": "Hemoglobin A1c", "value": "8.4", "unit": "%", "observed_at": "2026-04-27", "freshness": "recent"}
  ],
  "llm_output": {
    "answer_type": "pre_room_brief",
    "claims": [
      {"text": "A1c rose from 7.2 to 8.9 over 90 days.", "claim_type": "trend", "source_ids": ["lab:procedure_result:701", "lab:procedure_result:777"], "caveat": null}
    ],
    "missing_data": [],
    "refusals": [],
    "suggested_followups": []
  },
  "expectations": {
    "verifier_status": "failed",
    "min_dropped": 1,
    "rules_must_fire": ["source_value_mismatch"]
  }
}
