{
  "case_id": "citation/01_happy_path",
  "category": "citation",
  "description": "Citation present: claim cites a valid source packet with matching value.",
  "mode": "verifier",
  "rubrics": [
    "schema_valid",
    "citation_present",
    "factually_consistent"
  ],
  "what_bug_this_catches": "Regression where citation_present rubric passes even when source_ids list is empty.",
  "packets": [
    {
      "source_id": "lab:ldl:001",
      "patient_uuid": "uuid-chen-001",
      "resource_type": "Observation",
      "source_table": "procedure_result",
      "field": "result",
      "label": "LDL",
      "value": "122",
      "unit": "mg/dL",
      "observed_at": "2026-04-01",
      "freshness": "recent",
      "status": "final",
      "source_type": "document_extract",
      "quote_or_value": "LDL: 122 mg/dL"
    }
  ],
  "llm_output": {
    "answer_type": "pre_room_brief",
    "claims": [
      {
        "text": "LDL was 122 mg/dL on 2026-04-01.",
        "claim_type": "fact",
        "source_ids": [
          "lab:ldl:001"
        ],
        "caveat": null
      }
    ],
    "missing_data": [],
    "refusals": [],
    "suggested_followups": []
  },
  "expectations": {
    "verifier_status": "passed",
    "min_accepted_claims": 1,
    "max_dropped": 0
  },
  "name": "01 happy path"
}
