{
  "name": "tool plan immunization selects immunization history",
  "mode": "tool_plan",
  "request": {
    "trace_id": "tp-29",
    "use_case": "immunization_history",
    "patient_uuid_hash": "hash"
  },
  "mocked_tool_plan": {
    "trace_id": "tp-29",
    "planner_status": "planned",
    "tool_calls": [
      {"name": "get_patient_identity", "arguments": {}},
      {"name": "get_immunization_history", "arguments": {}}
    ]
  },
  "expectations": {
    "planner_status": "planned",
    "expected_tools": ["get_patient_identity", "get_immunization_history"]
  }
}
