{
  "case_id": "regression/04_lists_rx_conflict",
  "category": "regression",
  "description": "Wk1 regression: lists_rx_conflict_unsurfaced — duplicate medication across lists and prescriptions must be flagged.",
  "mode": "verifier",
  "rubrics": ["schema_valid", "citation_present"],
  "what_bug_this_catches": "Wk1 regression: lists_rx_conflict_unsurfaced rule — when same drug is in both problem-list meds and prescriptions, verifier must surface it as a conflict.",
  "regression_marker": "wk1:07_lists_rx_conflict.json",
  "packets": [
    {"source_id": "med:lists:5", "patient_uuid": "uuid-A", "resource_type": "MedicationStatement", "source_table": "lists", "field": "title", "label": "Active medication (problem list)", "value": "Lisinopril 10mg daily", "freshness": "recent", "status": "active"},
    {"source_id": "rx:prescriptions:22", "patient_uuid": "uuid-A", "resource_type": "MedicationRequest", "source_table": "prescriptions", "field": "drug", "label": "Active prescription", "value": "lisinopril", "freshness": "recent", "status": "active"}
  ],
  "llm_output": {
    "answer_type": "pre_room_brief",
    "claims": [
      {"text": "Currently on Lisinopril 10mg daily.", "claim_type": "fact", "source_ids": ["med:lists:5"], "caveat": null}
    ],
    "missing_data": [],
    "refusals": [],
    "suggested_followups": []
  },
  "expectations": {
    "verifier_status": "passed_with_drops",
    "min_accepted_claims": 1,
    "rules_must_fire": ["lists_rx_conflict_unsurfaced"],
    "missing_data_must_mention": ["lisinopril"]
  }
}
